tweet,timestamp,bp_label
 50k is your finished WIP? CONGRATULATIONS!,2019-10-25 22:43:54+00:00,False
 Thank you!!,2019-10-25 19:31:17+00:00,False
" Well, then maybe they should just go for it, if it makes them happy.",2019-10-25 19:18:48+00:00,False
 That's a good length! Best of luck to you during the writing process!,2019-10-25 19:14:18+00:00,False
 https://t.co/mOIuEXkTPh,2019-10-25 18:53:58+00:00,False
 I'm sure you will :) just keep writing and you'll have it in no time,2019-10-25 18:47:49+00:00,False
 Thanks!! Wooo!!! Would you say that's about halfway?,2019-10-25 18:46:51+00:00,False
 Oh that is so awesome! I love when books just flow like that. Best of luck to you!,2019-10-25 18:46:11+00:00,False
 Huh that's interesting! That makes a lot of sense.,2019-10-25 18:32:22+00:00,False
" Everything counts in my book, chapter headings, titles, EVERYTHING.",2019-10-25 18:31:49+00:00,False
" How come so long, may I ask?",2019-10-25 18:30:18+00:00,False
" I mean, it doesn't matter TOO much lol https://t.co/IdwIrip2Pc",2019-10-25 18:26:58+00:00,False
 Woo!! It looks like you're almost there! How long are you thinking?,2019-10-25 18:26:18+00:00,False
 Thanks!,2019-10-25 18:25:46+00:00,False
" That makes sense, I write like that as well. Well best of luck to you! I hope it turns out like you want it!",2019-10-25 18:25:38+00:00,False
" Thanks! 
Hey 1500 words is better than none! What's your goal wc for the short story or are you just writing until it's finished?",2019-10-25 18:01:55+00:00,False
 What's your goal?? Hey 10k isn't too bad considering you've written 70k,2019-10-25 18:00:34+00:00,False
 Great work! It looks like you're almost on the finish line with the 70k!,2019-10-25 17:53:15+00:00,False
 Thanks so much for the advice! Greatly appreciate it :),2019-10-25 17:51:22+00:00,False
"Wow!!! Thank you so much for 3,000 followers! Y'all are amazing! 

Let's do a #WriterLift! 

What's your current word count? 

#WritingCommunity https://t.co/j5IFff9Tl4",2019-10-25 17:50:50+00:00,False
 https://t.co/21eCavaMsy,2019-10-25 17:42:13+00:00,False
" Really? That's encouraging, I've heard that it's a necessary for your author platform but I never knew if it would really help. Here goes, I guess lol",2019-10-25 17:40:13+00:00,False
 https://t.co/upH7vY8nVj,2019-10-25 17:33:24+00:00,False
" I use Facebook, but I'm starting up Instagram soon!",2019-10-25 17:30:11+00:00,False
" ""I'm so sick! I can't even move, I have a cold!""
🙄",2019-10-25 15:40:13+00:00,False
 Eating an orange and watching Band of Brothers...lol,2019-10-25 15:37:09+00:00,False
 https://t.co/LRTXthXXKM,2019-10-25 15:34:58+00:00,False
 I feel like this is a relationship that could quickly go sour...,2019-10-25 15:30:20+00:00,False
         https://t.co/uuFk18OGhK,2019-10-25 15:28:27+00:00,False
" Yes, this has happened to me. Specifically for the book I published, I read it so many times I have it memorized. I can't read it to this day because I'm so sick of it.",2019-10-25 15:26:51+00:00,False
 16. I used to be SUPER confident in high school even though I have no clue why.,2019-10-25 11:56:58+00:00,False
" I figured out a birthday for him, but it's not pertinent to the story 🤠",2019-10-25 11:51:56+00:00,False
 I've always loved history even as a little kid. It's just been natural for me to write. I'm an old soul.,2019-10-25 11:41:22+00:00,False
" Send it to my editor for a developmental edit, she sends it back to me, I incorporate some of her feedback into it, then she does a line edit, I do what she says to fix, and then I have someone proofread it before it goes to publication. 🤷",2019-10-25 01:47:57+00:00,False
" Well I write the first draft straight with very minimal going back and fixing things, then I leave it sit for a little while, I edit through it until I feel like I don't know what else to change/fix and then I let a few betas read it, then I incorporate their feedback and then I",2019-10-25 01:46:39+00:00,False
                                               Thank you for the shout out!,2019-10-24 23:03:34+00:00,False
" Great! Haha no worries, I completely understand that. Best of luck to you during NaNo!",2019-10-24 15:58:19+00:00,False
" Wishing it were Friday, that's for sure.",2019-10-24 14:05:04+00:00,False
 Wish I had a number on this. Do you mean how many times I go through it beginning to end? I usually will jump around and edit certain smaller things and then read it through. I have no count lol every book is different.,2019-10-24 14:04:25+00:00,False
 Intriguing!,2019-10-24 11:13:53+00:00,False
 That makes a lot of sense 😊,2019-10-24 11:12:58+00:00,False
"  Yeah, or they're just polite to you and you think the friendship is more than it is, etc .... Had that happen to me A LOT in high school.",2019-10-24 02:34:49+00:00,False
"  I understand what you're saying, but I have a few instances where I'd really have to disagree lol I agree everything happens for a reason, but sometimes the reason is they really dislike you and want you to leave.",2019-10-24 02:32:20+00:00,False
 https://t.co/muAIVM3jqV,2019-10-24 02:25:24+00:00,False
 It's not just a feeling for me. I've had people tell me straight up that they didn't want me in their life anymore. It hurts but what can you do? Some people I lost contact with but I feel like they never liked me to begin with. Just life I guess 😟,2019-10-24 02:22:40+00:00,False
" Not concerning romance, but as a historical fiction writer I have found this to be incredibly true. I'll get a little cocky thinking I know a thing or two, only to find out I was wrong. It can be humbling.",2019-10-24 01:55:37+00:00,False
 SAY IT LOUDER FOR THE PEOPLE IN THE BACK 👏👏👏,2019-10-24 01:50:21+00:00,False
" Words to live by! 
My current WIP is a historical fiction sci fi centering around the JFK and RFK assassinations. I'm honestly not sure what else to categorize it as lol 
How about you?",2019-10-24 01:48:00+00:00,False
 Definitely not! Haha that's exactly what I do. I have tons of word docs in separate folders for each book lol,2019-10-24 01:42:27+00:00,False
 Thunderstorms,2019-10-24 01:39:44+00:00,False
" Interesting, that's cool! I've always just used plain old Word. Haven't changed much over the last ten years lol",2019-10-24 01:39:24+00:00,False
 That makes a lot of sense. Your comment and others like it are giving me confidence that I'm not getting ahead of myself. Thank you!,2019-10-24 01:36:47+00:00,False
" That's no good 😞 I'm really trying to avoid burn out, I experienced a patch of it earlier this year and it was terrible. I'm glad you got the figured out, though, super important to have something like that!",2019-10-24 01:35:39+00:00,False
" Wow, thank you so much!! I hope you enjoy it 😊",2019-10-24 00:46:34+00:00,False
 Anytime ❤️ I'm sure I will! I read a little and I think we have similar styles of writing 😊,2019-10-24 00:21:28+00:00,False
 I downloaded your book 😊 I'm excited to start reading it!,2019-10-24 00:18:57+00:00,False
           Agreed! You too!!,2019-10-24 00:09:50+00:00,False
"           Awe thank you so much, Mike! https://t.co/6P7sU95HWy",2019-10-24 00:08:39+00:00,False
 This is very true,2019-10-24 00:07:25+00:00,False
" That's probably a good way to follow. Question, do you ever feel burned out?",2019-10-24 00:06:58+00:00,False
 Haha so far youre the first person who says they do this. Do you ever feel burned out?,2019-10-24 00:06:19+00:00,False
 https://t.co/OkQiZtcacm,2019-10-23 19:14:23+00:00,False
 I know the feeling. I don't think I could make it a month lol,2019-10-23 15:00:36+00:00,False
 Thank you for your advice! I'm definitely doing a week at least 😊,2019-10-23 15:00:10+00:00,False
 Haha that makes sense!,2019-10-23 14:01:59+00:00,False
 That makes sense 😊Thank you for the advice!,2019-10-23 14:01:22+00:00,False
 Thanks so much ❤️,2019-10-23 13:49:33+00:00,False
 Good deal! Thanks for your advice 😊,2019-10-23 13:48:43+00:00,False
 Good deal! Thanks for the advice!,2019-10-23 13:25:59+00:00,False
 Cool! I have never heard of that! Thanks for the advice!,2019-10-23 13:04:23+00:00,False
" You're welcome! Thank you, I really hope so too!",2019-10-23 12:56:48+00:00,False
 Well congrats on your novella! Sounds like you were smart about it. Good luck with everything 😊,2019-10-23 12:54:59+00:00,False
 Well I'm glad it's working out! How did you take a year out to just do writing? That sounds heavenly.,2019-10-23 12:34:44+00:00,False
" Yeah, it's true the deadline pushes me a little. I understand what you mean, makes a lot of sense! Not sure if I have ever lost that completely on any of my books haha",2019-10-23 12:33:19+00:00,False
 That actually makes a lot of sense. I hadn't thought of it like that. Thank you for your input!,2019-10-23 12:32:02+00:00,False
 That makes sense! I wrote it in 7 weeks 😋,2019-10-23 12:30:47+00:00,False
" Good deal! That's kind of what I was thinking of doing, I was just afraid I was jumping the gun and getting ahead of myself. I tend to work my brain to its full capacity lol",2019-10-23 12:26:07+00:00,False
 That makes sense. I can do that!,2019-10-23 12:22:22+00:00,False
" Interesting. Thanks for your input! It's actually novel length, I'm just not sure I can go 3 months without touching it haha",2019-10-23 12:21:01+00:00,False
 Thank you for your advice! 😊,2019-10-23 12:07:42+00:00,False
 I don't think I could wait 3 weeks either! 😆,2019-10-23 12:04:53+00:00,False
"  That's encouraging. I don't think I could do a month either. I was thinking about a week too, but was a little afraid I was jumping the gun lol",2019-10-23 12:04:24+00:00,False
 What happens if you feel both? Haha I wrote the story in a very short period of time and my brain feels a little taxed but I've been having ideas of how to fix it/make it better...,2019-10-23 12:03:03+00:00,False
  Beautiful cover! This looks like a fun one!,2019-10-23 11:58:23+00:00,False
"Hey #WritingCommunity, how long do you let your first draft marinate before diving back in to edit and revise? 

P.S. I am on a little bit of a deadline. 

#amwriting #writerslife #writing",2019-10-23 11:57:55+00:00,False
                    Thanks for the shout out!,2019-10-23 02:20:54+00:00,False
" Love audiobooks as I can listen to them at work. Thank you, I'll check it out 😊",2019-10-23 02:08:45+00:00,False
 Not sure what you mean by this...,2019-10-23 00:48:07+00:00,False
 Thank you!! It really is!,2019-10-23 00:47:48+00:00,False
"Wow thanks so much for all of the book recommendations. I will definitely do my best to read as much as I can. You guys have given me so many options, thank you!",2019-10-22 23:56:13+00:00,False
 Interesting plot twist! I'll check it out 😊,2019-10-22 23:54:45+00:00,False
" Haha I just wrote a full length novel in 7 weeks. (I finished it on Sunday) I'm itching to start revising but at the same time, honestly, my brain feels a little spent. Trying to recharge a little before getting back to it.",2019-10-22 22:51:59+00:00,False
 Anytime! I'm looking forward to reading it!,2019-10-22 22:26:31+00:00,False
" Just downloaded 😊 You had me at ""it's like the Hunger Games"" (a series I love) Can't wait to read!",2019-10-22 22:14:13+00:00,False
 🤗🤗 You made my day. Enjoy 😊,2019-10-22 22:10:56+00:00,False
 Thank you!!,2019-10-22 22:07:58+00:00,False
 Thank you so much!!!,2019-10-22 22:07:46+00:00,False
 Thank you!!,2019-10-22 20:40:25+00:00,False
 Sounds interesting! I'll take a look 😃,2019-10-22 20:28:39+00:00,False
 Sounds intriguing! I'll check it out 👍,2019-10-22 19:21:32+00:00,False
  Thanks for this!,2019-10-22 18:58:26+00:00,False
" I love WWII, so I'll definitely take a look!",2019-10-22 16:46:57+00:00,False
"  I got it on audible, and have been listening to it all morning. Very well written!",2019-10-22 16:46:29+00:00,False
 Thanks! I'll check it out!,2019-10-22 16:44:41+00:00,False
  I've actually already read it! Lol I thought the Hulu series was better than the book 😬,2019-10-22 15:30:17+00:00,False
 Whoa that sounds intense. I'll definitely check it out.,2019-10-22 14:58:19+00:00,False
 Love your cover! I'll check it out! Thanks :),2019-10-22 14:09:17+00:00,False
 I'll check it out! I love poetry 😍 and thanks!,2019-10-22 14:09:03+00:00,False
 Sweet! I'll check it out!,2019-10-22 13:19:50+00:00,False
 Okay great! That's definitely something I can get behind! Lol,2019-10-22 13:10:27+00:00,False
" Interesting!! I'll check it out--its not too creepy, is it? Lol",2019-10-22 13:07:11+00:00,False
" Thanks! Love the cover, I'll check it out!",2019-10-22 13:06:43+00:00,False
"  Thanks for the recommendation! Just saw that it's on audible, double win!",2019-10-22 13:05:40+00:00,False
" I know the feeling. It's just my opinion, but I don't think they're really all they're cracked up to be 🤷 I watched the first few episodes of GOT and was bored out of my mind.",2019-10-22 12:40:08+00:00,False
"Hey everybody, I'm taking the week off from writing so I'm looking for a book to read! 

Comment your book links and I'll pick one (I leave reviews!) 

I have no genre preference as I read most anything. 
#WritingCommunity #amwriting #writing #writerslife",2019-10-22 12:38:32+00:00,False
 The rules are there are no rules 😜,2019-10-22 12:27:02+00:00,False
 Hahahahahaha! That's called cheating!,2019-10-22 11:57:33+00:00,False
 You may be right lol,2019-10-22 11:57:01+00:00,False
 😂😂,2019-10-22 11:53:32+00:00,False
" I used to refuse to watch/read The Hunger Games when that was popular. As well as Harry Potter (books and movies) and Game of Thrones. 
Hunger Games was the only one I ended up liking of those 3 lol",2019-10-22 11:51:27+00:00,False
"Who would win in a fight, Taylor Swift or Beyonce? 
#TaylorSwift #Beyonce",2019-10-22 11:49:54+00:00,False
  Thank you 😊,2019-10-22 11:47:49+00:00,False
" It gives me solace. When I write, all the bad things in my life disappear (at least for a little while.)",2019-10-22 11:22:59+00:00,False
 Is your book published?,2019-10-21 19:47:40+00:00,False
 Thats so cool! I'm so glad it ended up working out!,2019-10-21 19:47:27+00:00,False
 Thank you!!! I'm planning on it 😁,2019-10-21 19:17:16+00:00,False
 Interesting!!! That makes a lot of sense to write it that way. Was it easier or harder to piece them together after you'd written the flashbacks?,2019-10-21 19:13:48+00:00,False
 Thanks! Haha I'm glad I can help you out 😊,2019-10-21 19:03:30+00:00,False
" Hey if it works, then it works! 😊",2019-10-21 16:58:49+00:00,False
 Thanks! I'm glad it can be!,2019-10-21 16:32:06+00:00,False
  I think I'm pretty normal!,2019-10-21 15:53:10+00:00,False
 Check out ingramspark,2019-10-21 15:40:38+00:00,False
 I love her! 😢,2019-10-21 15:38:27+00:00,False
" Hmmm... Well, I wrote a book this year so that's probably the best thing that happened to me.",2019-10-21 15:35:06+00:00,False
" Historical fiction sci fi, 96,000 words.",2019-10-21 15:33:27+00:00,False
 That makes a lot of sense.,2019-10-21 15:30:18+00:00,False
 That makes a lot of sense. Do all the exciting bits and fill it in later... I like it!,2019-10-21 13:45:37+00:00,False
"  It was! First time I saw the book in a store I thought it was a self help book (probably would have been more interesting that way lol) 
I can't believe it was popular. Seriously?!",2019-10-21 12:52:59+00:00,False
" I couldnt agree more. I spent a lot of my time in highschool writing learning valuable skills I don't think I would have been able to do otherwise. 
Thank you so much!",2019-10-21 12:26:46+00:00,False
" I, too, was homeschooled! I also wrote my first book at 13.",2019-10-21 12:19:36+00:00,False
" Skinnier. Increase my following, publish another book, write another book. Lots of goals for 2020 but let's get it done!",2019-10-21 12:17:01+00:00,False
 Sounds like a good weekend set up to me!,2019-10-21 12:15:22+00:00,False
" Eat. Pray. Love. 
Why was it made? I don't know. I couldn't watch the whole thing my brain was bleeding from how incredibly boring it was. What was the plot? I still don't know.",2019-10-21 12:14:27+00:00,False
 1996!,2019-10-21 12:13:06+00:00,False
" Oh I see lol sorry for the assumption, I mean, having two weekdays off is probably nice because you don't have people bothering you to do stuff versus the weekend if everyone else is off they're constantly inviting you to things. 
...I am an introvert lol I don't like to get out.",2019-10-21 12:11:58+00:00,False
" Since I write historical fiction I use real locations. I've done a couple books using fake locations, but for the most part I try to stick to the real places. If I were writing fantasy or really any other genre I would probably use fake.",2019-10-21 12:09:30+00:00,False
 I like having the weekends off. I know people who work the weekends and they're always complaining about it lol I love having two consecutive days off 🤷,2019-10-21 12:06:56+00:00,False
 Thank you ❤️,2019-10-21 11:30:31+00:00,False
 https://t.co/0kDmkHtmze,2019-10-21 11:29:43+00:00,False
 Haha that makes a lot of sense!,2019-10-21 11:29:15+00:00,False
 https://t.co/RtzVfasupX,2019-10-21 11:28:14+00:00,False
 Thank you so much!,2019-10-21 11:27:44+00:00,False
 Haha that's a really good way to put it. Well whatever works for you 😊 I've always liked the structure myself lol,2019-10-21 01:42:34+00:00,False
 Interesting. So are you a plotter or a pantser?,2019-10-21 01:35:38+00:00,False
 Thank you so so much!!,2019-10-21 01:34:23+00:00,False
 That makes a lot of sense. Have you ever done stand alones?,2019-10-21 01:34:07+00:00,False
" Good deal, that's definitely how I work as well 😁",2019-10-21 01:32:34+00:00,False
" Thank you 😊 It really takes discipline, but there's nothing I love more than writing so 🤷",2019-10-21 00:31:40+00:00,False
 Thank you! It was a lot of hard work. I write at least 3 hours a day (more on weekends) but this is the fastest I've ever written a book. New milestone achieved!,2019-10-21 00:15:18+00:00,False
 Thank you so much!!!,2019-10-20 23:50:14+00:00,False
 Thank you so much!!! And congratulations to you as well!!,2019-10-20 23:39:33+00:00,False
 Thank you!!!!,2019-10-20 23:39:18+00:00,False
" THANK YOU!!!! 96,870",2019-10-20 23:39:06+00:00,False
 THANK YOU SO MUCH!!!,2019-10-20 23:38:29+00:00,False
"You guys, I did it. It finally happened.
 
I just finished the first draft of my 7th book!!! AHHH!!! 

September 3 - October 20! 

There's a lot of editing and revising to be done, but, that can begin later. 
#amwriting #writingcommmunity #writers #writerslife #writing https://t.co/l3uQzTdebC",2019-10-20 23:15:30+00:00,False
  I can finally say it: 7.,2019-10-20 23:03:05+00:00,False
 That makes a lot of sense. I suppose I work like that when I'm editing a book as well.,2019-10-20 22:25:52+00:00,False
"Do you write your books in sequence or out of order? 

I write mine in sequence as I liked be in the character's head space as they experience each new thing. 
#amwriting #WritingCommunity #writing",2019-10-20 19:13:33+00:00,False
" Give peace a chance - John Lennon
On holiday - Green Day",2019-10-20 18:02:13+00:00,False
" The first 5 seasons are the best as they were the original story arc. The following seasons are pretty good, but the first five are FANTASTIC.",2019-10-20 17:12:54+00:00,False
 I am 4 chapters away from completing the first draft of my WIP. I'm taking myself out for a steak dinner and drinking lots of wine. https://t.co/kRbY7lMEkB,2019-10-20 16:37:27+00:00,False
" Gray area. My current WIP, the girl struggles with the ""evil"" thing she is being pressured to do but in the end she does it.",2019-10-20 16:33:40+00:00,False
" She has great taste! Friends is my favorite sitcom. And I agree, Joey is great!!",2019-10-20 15:14:05+00:00,False
 🤷 https://t.co/jhRcITpiJr,2019-10-20 15:03:01+00:00,False
 Word. Forever and always.,2019-10-20 14:39:05+00:00,False
 Google play. I get YouTube with no commercials with it.,2019-10-20 13:15:49+00:00,False
 Hello! Mine is a historical fiction sci fi based on the JFK and RFK assassinations.,2019-10-20 13:14:12+00:00,False
 https://t.co/EiDun4R5sJ,2019-10-20 13:08:19+00:00,False
" Let me just say, if there were a time machine that could take me to the 60s I'd be hopping in it without a second thought and never looking back.",2019-10-20 02:27:43+00:00,False
 ........ I don't like Beyonce. 🤷,2019-10-20 02:24:38+00:00,False
" I got the idea for one of my characters from Roger Taylor, the drummer of Queen. That was the first idea for this book and it just grew from there. Not really sure where the rest of it came from. https://t.co/XdMExDIn2e",2019-10-20 02:00:12+00:00,False
 I know the feeling! I've never understood how some people repel them,2019-10-20 01:03:11+00:00,False
" Oh, they choose me as well. I don't like to go to 4th of July fireworks because no matter how much bug spray I put on, I will be covered in the little beasts.",2019-10-20 00:29:55+00:00,False
" When I'm alone, at my desk, writing. I have the freedom to express my own thoughts without people telling me I shouldn't think that way or I'm wrong, etc. I can finally be ME.",2019-10-20 00:29:00+00:00,False
  Followed 😉,2019-10-20 00:27:58+00:00,False
" Your foot in the door as 3 out of the 4 agents I pitched to all had manuscript requests. (I eventually got rejected) Good experience nonetheless, apart from the crippling anxiety that comes with pitching your work to agents.",2019-10-20 00:27:29+00:00,True
" I've been to 2, one in South Carolina and another in Chicago. I pitched to agents at both events. I didn't feel like I learned to much from the talks that were given other than ""don't start your book with a dream sequence"" but I think if you're going trad it's a great way to get",2019-10-20 00:26:22+00:00,False
" One.
The Puppeteer. 
Main characters: Jane and Eugene Everton.",2019-10-20 00:23:54+00:00,False
 Thank you!!,2019-10-19 23:37:31+00:00,False
" I've always relied more on word count. If I stay under 110,000 I'm doing well.",2019-10-19 22:27:12+00:00,False
 Publish another book,2019-10-19 22:20:56+00:00,False
 WRITE.,2019-10-19 22:20:42+00:00,False
 Give away my unlimited money to charities who are making the world better (i.e. building wells in African villages),2019-10-19 22:18:47+00:00,False
"  I find it both ways. Sometimes I love the act of writing, but sometimes it's really really hard but after I finish I feel good that I did it. So 🤷",2019-10-19 22:16:12+00:00,False
 This tweet made my day. Thanks for the laugh lol 😂,2019-10-19 22:14:48+00:00,False
 https://t.co/TCC1Lq7PWl,2019-10-19 21:57:59+00:00,False
 1985 DeLorean because I gotta have some style.,2019-10-19 21:57:24+00:00,False
"4 more chapters to go before I finish drafting! 
#WIP #amwriting #WritingCommunity https://t.co/fwyVp1qIbZ",2019-10-19 21:56:15+00:00,False
 Probably a 7 or an 8.,2019-10-19 21:54:51+00:00,False
" That's good. Sometimes you just have to and that's okay! 
I hope you feel better! https://t.co/yPsmnPwGg6",2019-10-19 21:30:39+00:00,False
" I have extreme paranoia/anxiety and once people just spoke to me and helped me through it, I was able to kind of get through it, if that makes sense.",2019-10-19 21:25:59+00:00,True
" Well then just allow yourself to be anxious. I used to struggle with anxiety BIG TIME and I just had to let myself be, sometimes talking to people about what was upsetting me calmed down, but until I got over that hump I just had to ""be"". Just remember, it does not control you",2019-10-19 21:25:09+00:00,True
 SUMMER. ANY DAY.,2019-10-19 21:18:23+00:00,False
" Top 4 main, main supporting: Editor of a newspaper, CIA agent, jet engine welder, and seamstress/fashion designer",2019-10-19 21:18:02+00:00,False
" I try to give myself compassion that I'm just having a bad day, and allow myself to feel bad. Some days are just bad and it's hard to change and you've got to just be kind to yourself. Take it easy and do some things you love. Sometimes journaling, coloring, reading helps. ❤️",2019-10-19 21:16:25+00:00,False
 I'm so sorry 😢 I hope it gets better!,2019-10-19 21:12:08+00:00,False
" Haha I know how that goes, too",2019-10-19 20:53:48+00:00,False
" I like to start mine with major personality flaws. I don't know if that makes them an ""every man"" but I then make them over come their flaws and become heroic, so in a way, yes I do that",2019-10-19 20:45:09+00:00,False
 I'm in disbelief the things alcohol makes a person do 😂,2019-10-19 19:04:38+00:00,False
"I'm having one of those ""Whoa, did that really just happen? Kind of day.",2019-10-19 19:02:45+00:00,False
 Wine 🍷,2019-10-19 19:01:30+00:00,False
" No I think it's smart, get it out of the way sooner rather than later. I'd do mine now but I have no idea what to buy lol
Glad your book is coming along!",2019-10-19 16:53:04+00:00,False
 What an awesome way to spend a Friday! Your book sounds juicy 😉,2019-10-19 16:33:07+00:00,False
 Wow that sounds like a great job!,2019-10-19 16:31:49+00:00,False
 That sounds like a nice way to spend your weekend 😊,2019-10-19 16:30:46+00:00,False
             Thanks for the shout out!,2019-10-18 22:49:44+00:00,False
" Ah I see. Yeah I just stream everything, they have almost everything online at least. But very true lol",2019-10-18 19:17:08+00:00,False
 Awe well little by little. I'm so glad you can spend time with them like that. I'll be praying for you can get back on your feet 🙏,2019-10-18 19:15:45+00:00,False
 Awwww he's a cutie ❤️,2019-10-18 17:42:58+00:00,False
" Wow, that's so awesome!! I believe you'll definitely get there!",2019-10-18 17:42:27+00:00,False
 https://t.co/vsBZKF1T9l,2019-10-18 17:41:11+00:00,False
 Woohoo!!! https://t.co/8S0KtyK3mn,2019-10-18 17:39:31+00:00,False
 Oh that's nice! Use it well!,2019-10-18 17:38:37+00:00,False
