tweet,timestamp,bp_label
                                               Wow thanks for the shout out!,2020-02-26 18:48:10+00:00,False
" Oh interesting! I think I've heard of that writer actually.

Lol I figured inept wasn't the right word",2020-02-26 17:49:29+00:00,False
  That's very true 😀,2020-02-26 13:51:16+00:00,False
 I'd love to be an actor in Hollywood. Maybe it's attainable....maybe it's not....,2020-02-26 13:34:00+00:00,False
 I agree 😏 I gotta admit I haven't seen either of those! 🙈,2020-02-26 13:31:57+00:00,False
" Good point, Hitchcock was master!",2020-02-26 11:58:57+00:00,False
 Cute! Love the sleeves!,2020-02-26 01:14:26+00:00,False
 No food or water for 24 hours. PIECE OF CAKE.,2020-02-26 01:11:41+00:00,False
 Followed 😏,2020-02-26 01:11:01+00:00,False
 I overthink everything!,2020-02-26 01:07:45+00:00,False
 Amen!!,2020-02-26 00:25:38+00:00,False
 Oh I definitely know what you mean. I was also inspired by video games and one of my first stories was based off my favorite one. But books inspired me to actually write a BOOK.,2020-02-26 00:24:59+00:00,False
" Whew! That's huge!! Doesn't have the gift of summary, huh? Lol jk",2020-02-25 23:59:01+00:00,False
" Huh that's interesting, I've never heard of him! I just may have to check it out",2020-02-25 23:56:14+00:00,False
 https://t.co/Vq519l3tGa,2020-02-25 23:51:50+00:00,False
 Interesting variation! When I was a kid video games inspired me. What's your favorite?,2020-02-25 23:49:19+00:00,False
" Oh I know what you mean, I draw inspiration from there as well. What book has made you the angriest?",2020-02-25 23:48:50+00:00,False
"Watching clips from Little Women and I am itching to start writing my next book.

Movies definitely are an inspiration to me and my writing. 

What about you? 

#WritingCommunity #amwriting #writerslife #writing #LittleWomen",2020-02-25 23:29:18+00:00,False
 Oh all the time. I am an insomniac so if I nap I won't sleep that night. So I never nap even though it would be great sometimes.,2020-02-25 23:25:37+00:00,False
 That's amazing!! Keep it up! It feels so good when it just comes pouring out.,2020-02-25 20:40:00+00:00,False
" It's difficult for me to set goals when I edit. Honestly I'm happy to just ""get as much as I can done."" Whatever the amount may be. Note, I hate editing. I don't putz but I get discouraged if I don't complete x amount of chapters that I set prior to starting.",2020-02-25 20:00:50+00:00,False
" I have my lunch made and my clothes laid out the night before so the next morning all I have to do is let my dog out, throw my clothes on, and throw the food in my lunchbox and I'm out the door. I wake up at 5:15. Every minute of sleep is worth saving.",2020-02-25 19:58:00+00:00,False
"                                         Thanks Melina! Including: 
        ",2020-02-25 17:59:29+00:00,False
"   Yes! I was just about to message you. That would be perfect, thank you!!",2020-02-25 16:31:16+00:00,False
"Congratulations to , , and ! I'm giving you guys all a free copy of my book, Where Demons Dance! Thanks again for following 😊",2020-02-25 16:28:46+00:00,False
 Thank you!! https://t.co/Jv1oVOqc6E,2020-02-25 12:04:53+00:00,False
  Oh my gosh. It's already beautiful. LOOK AT THAT CHEST. I can't 🙈,2020-02-25 03:28:21+00:00,False
 I think Sunflower.,2020-02-25 01:14:28+00:00,False
  Ringo added so much to the music and the band!!,2020-02-24 21:31:47+00:00,False
"Wow, 4k followers!! You guys are awesome!!! Thanks so much for following.

We should do something fun. Who would like a FREE, signed copy of my novel, Where Demons Dance?? 

Like or comment!! 😸 

#WritingCommunity #writing #writerslife #amwriting #books #giveaway",2020-02-24 19:58:41+00:00,False
"                   Thanks, Anya!!",2020-02-24 16:34:51+00:00,False
  Thank you 😀 I think I will!,2020-02-24 16:34:26+00:00,False
" I plot first. I am not a pantser by any means. I write historical fiction so I will plan out the entire plot and outline my characters before starting. 
That's cool! I hope it goes well 😁",2020-02-23 19:53:39+00:00,False
 Thanks 😏,2020-02-23 18:33:37+00:00,False
" Hahaha well thank you very much. That being said, I still can't get a date from guys 😩",2020-02-23 18:30:28+00:00,False
 Haha this is very true. I choose my candy spots with care,2020-02-23 18:27:41+00:00,False
"  I loved it as well! No worries, lol, it wasn't very good",2020-02-23 18:26:12+00:00,False
 This is very true!!,2020-02-23 18:25:31+00:00,False
" That's what I've heard too, and it definitely takes the fun out of it. One a month sounds doable. Good luck!",2020-02-23 18:24:23+00:00,False
Probably a solid 8. https://t.co/vFQoTuiV7Z,2020-02-23 06:21:16+00:00,False
"I sincerely hope that the lady who checked me out at the gas station doesn't think all the candy I bought is just for me.

Cause let's be real, it is.",2020-02-22 23:24:17+00:00,False
" Thank you!!! Sounds interesting, I'll check it out 😏",2020-02-22 23:21:10+00:00,False
"  Shhhh, I'll never tell 🤫",2020-02-22 23:20:41+00:00,False
 Good luck to you!!,2020-02-22 23:20:00+00:00,False
 Finding a unique story can be incredibly difficult because of the sheer amount there are out there. I wish I had both talents,2020-02-22 22:31:17+00:00,False
" Thanks for the recommendation! I'll check it out. Yeah, having the time is definitely a huge struggle ☹️",2020-02-22 22:30:14+00:00,False
 Thank you!!,2020-02-22 22:24:43+00:00,False
 I don't have any good friends 🤷‍♀️,2020-02-22 15:36:45+00:00,False
 Taste. Because then I wouldn't mind eating celery all day instead of dying for some cake.,2020-02-22 15:34:41+00:00,False
"                                           Thanks, Anya!",2020-02-22 15:31:56+00:00,False
 All. The. Time.,2020-02-22 15:21:40+00:00,False
" I mean, I'm not saying people didn't swear, it just seems a bit overboard is all I'm saying. And of course you had the ""rebellious"" kids who would want to swear all the time, but I'm saying generally people didn't swear as much as today.",2020-02-22 15:13:53+00:00,False
" 4th grade, I wrote a 15 page book about a young girl's ""trail diary"" who was on a journey on the Oregon Trail.",2020-02-22 14:46:24+00:00,False
 That sounds a lot like how my blog is now as well 😂,2020-02-22 14:43:20+00:00,False
" I don't like it either. Sometimes the sets/costumes can look cool, but they're twisting it for audiences.
 I guess so. I don't find it appealing lol 
Oh yeah, I hate that, especially when there's so much music of the time period to choose from!!",2020-02-22 14:42:18+00:00,False
 Me too!!,2020-02-22 04:11:23+00:00,False
" I have been in the darkest pits of hell and I thought about ending it so many times, but I am on the other side of it now and life is so worth sticking around for.",2020-02-22 04:11:10+00:00,False
" I have been there. Oh, have I been there. So many times. I'm here if you need to talk. The way you feel right now is not how you will always feel. You are worth so much and so important to this world. It can be hard to see, but you are here for a reason.",2020-02-22 04:09:24+00:00,False
" Oh honey, if donuts had no calories I'd eat them daily.",2020-02-22 04:05:41+00:00,False
 I didn't know there was gonna be one for Falling. I'm psyched cause I absolutely LOVE that song.,2020-02-22 04:05:08+00:00,False
" I guess everyone wants to live where there's nice weather, lol",2020-02-22 03:56:31+00:00,False
"  Exactly! Haha well I can find you as a reliable source on the swearing, even though you haven't fought demons lol",2020-02-22 03:55:22+00:00,False
 Wow that's crazy. California just doesn't have room for people anymore,2020-02-22 03:53:55+00:00,False
 I really think you should. They're taking advantage of people.,2020-02-22 03:52:22+00:00,False
 That's super crazy though. I pay $500 and live in a 2 bedroom with one roommate. I don't think it's something I could ever warm up to lol,2020-02-22 03:51:48+00:00,False
" You're welcome. HUGE pet peeve. Like the kids in Stranger Things would not swear half as much as they do in the show. It's just historically inaccurate. I feel like I get jumped on all the time for having one thing ""wrong"" in hist fic and then I see this stuff and I'm like wha?",2020-02-22 03:50:30+00:00,False
 What the literal heck. That's terrible!!!,2020-02-22 03:47:40+00:00,False
 Shit. Is there a reason why? That seems so cramped. I can't imagine living in such tight quarters.,2020-02-22 03:47:14+00:00,False
 Sorry I can't offer you more. How many girls are in a room??? Are they big rooms? Do you all sleep on the floor? I just don't know how that's possible... Rent must be cheaper?,2020-02-22 03:45:17+00:00,False
 This made me laugh out loud lol,2020-02-22 03:43:20+00:00,False
"  Meh, what's the point at that rate?",2020-02-22 03:39:15+00:00,False
" Good at English. 
I got a 13 in math on the ACT, if that says anything about how good I am at THAT subject. 😒",2020-02-22 03:38:28+00:00,False
  Thanks!!,2020-02-22 03:37:11+00:00,False
" Oh my god, I'm so sorry.",2020-02-22 03:35:55+00:00,False
 I wrote my first book at 12. I'm 23 and written 7. What does that make me? Lol,2020-02-22 03:35:28+00:00,False
     I have heard of these statistics. Thanks for pointing them out! Modern medicine has been huge in advancing life expectancy.,2020-02-22 03:03:11+00:00,False
"The thing I've been noticing a lot lately in historical tv/film dramas representing the 60s, 70s or 80s is the unrealistic amount of swearing. 

Sure people swore but it wasn't dropping the f word six times in one sentence. Geez. 

#inaccurate",2020-02-22 02:59:47+00:00,False
 Maybe that's my problem. Things have been pretty uninteresting for quite a while for me. Nothing to break up the monotony.,2020-02-22 02:30:00+00:00,False
 No problem 😁 glad to be of service! Always here 😁,2020-02-22 02:22:57+00:00,False
 I'm glad it's not just me!,2020-02-22 02:19:10+00:00,False
" Will change, why, where, and when. Pantsers often get writer's block because they don't know how to continue the plot, but if you outline it helps to write the book quicker without fewer bumps in the road. If you have any Q's, feel free to ask! I've been doing this a while lol",2020-02-22 02:17:29+00:00,False
 Hmm what are you looking for? Create character profiles for your characters so you get to know them. Figure out how you want them to start off and their characters arcs in the story. Outlines are extremely helpful to plot out the book first and to add in how your characters,2020-02-22 02:15:40+00:00,False
 Thank you ❤️,2020-02-22 02:00:08+00:00,False
 That's very much how I feel,2020-02-22 01:59:48+00:00,False
"    I would think that the life expectancy was because of lack of sanitation, clean water and access to proper medical care. If you had a heart attack back then, you died.",2020-02-22 01:16:43+00:00,False
 https://t.co/6phrwWSOjF,2020-02-21 22:28:44+00:00,False
  Thank you for your input. Your blog sounds cool!,2020-02-21 22:23:55+00:00,False
 Me too!!,2020-02-21 22:23:30+00:00,False
 Hahaha well I haven't either!,2020-02-21 21:35:01+00:00,False
 Thanks so much for you input! I'll check it out 👍 everything I write for my blog is only 500 words usually so I know how that goes.,2020-02-21 21:14:33+00:00,False
 Thanks for your input!,2020-02-21 21:12:58+00:00,False
 Thank you 😊,2020-02-21 21:12:44+00:00,False
" Yeah, I'm in the same boat and wondering if I should take the few measly posts that I have up, down. I do have an author website but that's all right now.",2020-02-21 20:56:43+00:00,False
" Hey, sounds good to me! We earned it!",2020-02-21 20:47:12+00:00,False
" That's how I feel! Even with marketing, it's like I could be writing right now.",2020-02-21 20:45:57+00:00,False
 Hey if we put it together we might be able to actually buy something!,2020-02-21 20:43:19+00:00,False
 Thank you very much. I'm just wondering if blogging is something I should do or not. Wondering if my talents should be used elsewhere in marketing.,2020-02-21 20:39:39+00:00,False
" Thanks so much for your input. That's kind of how I feel about it right now, too. I'm currently making no money off at LOL",2020-02-21 20:38:01+00:00,False
 My own journey with mental health. Thought about writing it in parts...,2020-02-21 20:36:10+00:00,True
 After posting this tweet I'm considering doing that as well lol,2020-02-21 20:35:17+00:00,False
" That's more what I was going for, to write like a big chunk of blogs and post them little by little.",2020-02-21 20:34:35+00:00,False
 I know the feeling ☹️,2020-02-21 20:33:44+00:00,False
 I've thought about going for social commentary or my opinions on certain things with some writing stuff thrown in. However I haven't written anything because I don't have a lot of confidence in my topics.,2020-02-21 20:32:51+00:00,False
 Thank you for that advice. It's hugely appreciated. I'm glad I posted this tweet because now I'm considering restructuring my endeavors.,2020-02-21 20:25:22+00:00,False
" Topics and content. I had an idea of writing more social commentary but I can't figure it out, honestly.",2020-02-21 20:24:36+00:00,False
 Very well put. Interesting. I'll have to think about that. Thanks!,2020-02-21 20:23:18+00:00,False
  That's so awesome though. I wish you luck! It'll be great 😁,2020-02-21 20:22:35+00:00,False
" Interesting, really??? Wow that gives me so much hope. I felt like I had to have one. Maybe I shouldn't endeavor it at all?? Maybe I'll go more with social media. Huh. Thanks for your input!",2020-02-21 20:21:59+00:00,False
 Cool! I'll check it out 😏,2020-02-21 20:20:24+00:00,False
" I screenshotted your answer. Thank you for input, that's great advice! Much appreciated 😃",2020-02-21 20:19:47+00:00,False
" See, that's kind of what I struggle with to a certain extent. But people all over tell me how necessary it is to have a blog as a writer. So I feel like I SHOULD be doing this, ya know?",2020-02-21 20:14:24+00:00,False
" Interesting! Can you tell me more about your blog? I, too, write historical fiction. Are you creating short stories that focus on your characters?",2020-02-21 20:00:05+00:00,False
 Thanks for your input! These help a lot actually. It's the overthinking that's killing me ☹️,2020-02-21 19:59:03+00:00,False
 I understand. I am a custodian and I clean the same building every day. After work I go home and write for a few hours and go to bed. Repeat.,2020-02-21 19:42:24+00:00,False
 That's a very good point! I don't usually read blogs so I definitely should do more of that. Thanks!!,2020-02-21 19:35:23+00:00,False
 How can we do this?,2020-02-21 19:34:17+00:00,False
" Yeah ☹️ that's what I've heard as well. I want to use it to gain more followers yeah, but I want to have it so that if people are interested in my book, there is more content for them from me than just my book.",2020-02-21 19:33:35+00:00,False
 Oh definitely. I just have to actually put content out to link it back lol thanks for the advice! I do try to keep all my social media platforms connected.,2020-02-21 19:32:11+00:00,False
 Very true!!!,2020-02-21 19:31:31+00:00,False
" Hahaha this comment made me laugh. That's how I feel about Instagram. People tell me to posts pictures of my life. Like guys, I literally do the same thing every day of the week. There's nothing interesting about it. 
Wish I could help you out, but I so understand.",2020-02-21 19:27:36+00:00,False
" I could do a schedule, it's the content ideas I struggle with.",2020-02-21 19:16:05+00:00,False
 Thanks for the advice!! I've been trying to write a plethora of blogs so that I can have a schedule and have a library of them to choose from to post...it's just coming up with the content.,2020-02-21 19:15:35+00:00,False
 Huh that's interesting. That makes me feel better because everything I've written for my blog only ever ends up being 500 words (or around that figure) I can't seem to come up with more to say than that.,2020-02-21 19:14:27+00:00,False
" You're lucky!!! It's my author website and personal blog. I'm trying to do more marketing on my book and I feel like my website needs to be active rather than ""wow this post is 8 months old...""",2020-02-21 19:13:32+00:00,False
 You are extremely gifted. I'm trying to go with more that angle but I am still struggling. Ugh.,2020-02-21 19:11:47+00:00,False
" Yeah, you're probably right. How do I get out of my head is the next question lol",2020-02-21 19:11:16+00:00,False
" That's cool. My first attempt was to ""write about writing"" but the lack of inspiration has spurred me toward ""writing about topics and issues I care about."" But I still can't seem to bring myself to do it. I'll check yours out!",2020-02-21 19:10:46+00:00,False
" Yeah that makes a lot of sense. That seems to be the general understanding, lol everyone wants money for their advice. But it is tough, couldn't agree more.",2020-02-21 19:09:32+00:00,False
 That's exactly how I feel. I'll write ideas for blogs down and quake in my boots at the very thought of writing it. Ugh.,2020-02-21 19:08:34+00:00,False
"Am I the only one who struggles when it comes to writing for a blog? 

How does one get better at this? 

Write a book? No problem. Write a blog? I just can't seem to figure it out 😣 

#writingcommunity #writing #amwriting #writerslife",2020-02-21 19:04:40+00:00,False
 That's awesome! I'd love to talk to you more about marketing. I really struggle with it. I'm curious if you have any suggestions on how to get yourself out there more? I know getting on podcasts is one way for exposure...,2020-02-21 18:28:06+00:00,False
 Well I believe in you 😀 persistence is key!,2020-02-21 18:25:03+00:00,False
" Awe 💔 well I know exactly how you feel. Sometimes it's like wow, why do I even bother? But it's not for the money that I work so hard. Keep going!!",2020-02-21 18:22:27+00:00,False
" Hey every dollar is awesome. That's how I view it. Bummer it's not enough to make it your real job, but every dollar brings it closer!",2020-02-21 18:21:34+00:00,False
 Hey you gotta start somewhere!,2020-02-21 17:50:28+00:00,False
 https://t.co/tMzGWmcuxO,2020-02-21 17:48:41+00:00,False
 I'm editing a WIP. I'm hoping a couple of weeks.,2020-02-21 17:10:03+00:00,False
 Get the best snacks!!! Cover up the time and your word counter with post it notes so you're not distracted by either.,2020-02-21 17:09:07+00:00,False
 I find bittersweet to be the most realistic and that's what I like because I can connect to it better.,2020-02-21 17:07:57+00:00,False
" 🙋🙋 I haven't sold a fantastic number, but I have sold a few (more than just friends and family as well)",2020-02-21 16:36:24+00:00,False
"To all those people who ask me ""Oh hey, how's your book going?"" 

Well, hold onto your butts cause I made a whopping $1.05 in the month of February!!!

#writingcommunity #writers #amwriting #writing #writerslife",2020-02-21 16:34:10+00:00,False
" One of my favorite as well! 

Thanks! You too!",2020-02-21 15:14:11+00:00,False
 One of my favorite quotes ❤️,2020-02-21 14:48:21+00:00,False
 I agree. I think you can get to a level where it's no longer a challenge persay. Then you've most likely become a master at it.,2020-02-21 12:22:58+00:00,False
 Thank you!!! 👏👏 I think this is the best explanation I've heard on this topic.,2020-02-21 12:21:22+00:00,False
" Thank you for your input. I agree with you because I do think there are masters out there, that being said, I'm sure it takes enormous amounts of practice, practice, practice.",2020-02-21 12:20:20+00:00,False
" Interesting. I doubt the word count is 100,000? It's gotta be more than that!",2020-02-21 12:18:45+00:00,False
"   Absolutely nothing wrong with that lifestyle. I honestly think it's healthier than what you buy at the store. 
Hahaha good to know 😂",2020-02-21 12:17:30+00:00,False
" I'm from Wisconsin. 

Fun fact, it was 11° F out today. 
It was also 18°F in Antarctica today. 😐",2020-02-21 03:05:48+00:00,False
 https://t.co/r3Zu0CY4Ag,2020-02-21 02:57:19+00:00,False
 Bittersweet. I like when things don't always work out how you plan. I don't like dismal but I feel like that happy is too unrealistic.,2020-02-21 02:56:42+00:00,False
 https://t.co/cZGrPxuujA,2020-02-21 02:55:40+00:00,False
 I'm gonna say 30+. I'm turning 24 this year and I'm praying life gets better when I'm older. I've heard good things 🤷‍♀️,2020-02-21 02:54:55+00:00,False
"  I get what you mean, I was also raised on a farm and we butchered and ate a lot of animals we raised there. I was saying as how in the 1800s it was much more common place to eat what you grew versus today.",2020-02-21 02:52:39+00:00,False
" So... Basically how they used to do it in the 1800s and before? Yes, I could do it.",2020-02-21 01:33:53+00:00,False
" I am on the second book of my series. I'm approaching it as though it were the first in the series. I'm still trying to figure out what makes it 'tick,' however. I also view it as a continuation of the storylines I began in book 1...",2020-02-21 00:57:11+00:00,False
 Glad to be of service! 💁 It won't!,2020-02-21 00:49:55+00:00,False
" Ahhh I see. That makes a little more sense lol. Well, I hope it's not too bad!",2020-02-21 00:24:33+00:00,False
 I understand completely. However my desire to be done with editing is much bigger than anything else lol,2020-02-21 00:23:55+00:00,False
 Thanks!!,2020-02-20 23:43:27+00:00,False
 Oh well it's just me then 😂 you're lucky!! Great analogy 👍,2020-02-20 23:40:23+00:00,False
" I'm very sorry. Keep at it, you'll get to the end of that line edit sooner or later.",2020-02-20 23:30:17+00:00,False
" Very interesting point, could very well be. Though I can't imagine spending 10,000 hours on just haiku lol",2020-02-20 23:29:16+00:00,False
 Couldn't have said it better myself! I'm currently reworking my book after a line edit and I can say with much certainty that this is true. https://t.co/akAErtvW4d,2020-02-20 22:43:07+00:00,False
" No, no, it's okay. If they didn't tell you anything then how would you know? Kdp is how you access your Amazon books (usually if you self publish) I'm just guessing it's probably the same through author house though I'm not sure.",2020-02-20 22:39:58+00:00,False
" You should visit Wisconsin. 

We had 6 inches fall in a span of a few hours not last weekend but the one before it. And it's snowed multiple times since then lol.",2020-02-20 22:31:24+00:00,False
 Do you have a kdp account? Weird that you don't know how to find sales... Hopefully they can give you an answer 🙂,2020-02-20 22:23:19+00:00,False
 You should look! It could be doing really well!,2020-02-20 22:17:53+00:00,False
 I'm so so sorry 💔 😢,2020-02-20 22:17:29+00:00,False
 Pizza. 😣,2020-02-20 22:14:43+00:00,False
" Hmmm looks like a vanity press to me, but either way. Are you getting a lot of sales?",2020-02-20 22:13:53+00:00,False
 What platform did you use to publish your book?,2020-02-20 22:11:02+00:00,False
" Friends, definitely. I've seen it all the way through like 5 times already. Doesn't get old.",2020-02-20 20:37:36+00:00,False
"  Lol, amen.",2020-02-20 19:49:45+00:00,False
 I work on one project at a time. The reason being is because I can be fully focused and immersed in the story without being distracted by something else. I finish projects sooner and I get a lot more enjoyment than switching back and forth. 🤷‍♀️,2020-02-20 19:45:48+00:00,False
 Independent publishing houses that don't make you pay for the publishing process. I am having my books edited by a freelance editor (who I pay) to get them in the best shape possible before submission.,2020-02-20 18:44:39+00:00,False
" Are you saying with a vanity press? Because those will charge you. Also if you completely self publish you have to pay for everything. With my book, Where Demons Dance, that I self pubbed last year I had to pay for editing, cover, etc. With my other books I am going to use",2020-02-20 18:43:44+00:00,False
"""We choose to go to the moon not because it's easy. 
We choose to go to the moon because it is hard."" - JFK",2020-02-20 18:34:01+00:00,False
" Definitely! Yes I do. She is fantastic, I'm doing my 3rd book with her. Her name is Brooke Maddaford of Wordhawk Editing (in case you should need an editor.)",2020-02-20 18:27:39+00:00,False
" I see all my books as movies in my head. So to answer your question, ALL. THE. TIME.",2020-02-20 17:31:34+00:00,False
 Hahahaha same here!,2020-02-20 17:25:44+00:00,False
  That's definitely how I feel as well. Definitely 🙂,2020-02-20 16:50:19+00:00,False
" Very true! I'm not sure if we can, but I think you can come close haha",2020-02-20 16:49:37+00:00,False
" Hmmm.... My characters come first, or at least some vague idea of what they should be. They will often change 100 times before it's actually written. I tend to write character driven stories vs plot driven, so yeah, definitely characters.",2020-02-20 16:42:42+00:00,False
" Huh, interesting. I like that! What if you're just a bad teacher? 😂",2020-02-20 16:39:52+00:00,False
  Oh yeah I guess so lol thanks!,2020-02-20 16:39:27+00:00,False
"  Wow that's awesome that you've continued for so long! And I think I can agree with that, there's definitely always something to learn 🙂",2020-02-20 16:39:02+00:00,False
 Interesting perspective. I suppose I never really thought of it that way. And there's really no one out there who does everything perfectly when it comes to any kind of craft...,2020-02-20 16:36:54+00:00,False
" I've heard that too, but what I've wondered is, like what if you've been doing something for ten years? How do you track 10,000 hours?",2020-02-20 16:34:33+00:00,False
"Whether it be a musical instrument, writing or a trade, or anything else-- 

How long does it take to become a ""master"" at something?",2020-02-20 16:30:30+00:00,False
 I write 3 hours a day Mon-Fri. Weekends average about 6-7 hours each day.,2020-02-20 16:29:31+00:00,False
